name,official_name,presenting_organization,awarded_for
Grammys,Grammy Awards,The Recording Academy,Excellence in the recording industry
Emmy Primetime,Emmy Primetime Awards,Television Academy,Excellence in primetime television
Emmy Daytime,Emmy Daytime Awards,National Academy of Television Arts & Sciences,Excellence in daytime television
Tonys,Tony Awards,American Theatre Wing and The Broadway League,Excellence in Broadway theatre
Oscars,Oscar Awards (Academy Awards),Academy of Motion Picture Arts and Sciences,Excellence in the motion picture industry
